{
  "$schema": "https://json-schema.org/draft/2020-12/schema",
  "$id": "https://portfolio-copilot/schemas/liabilities.schema.json",
  "title": "LiabilitiesSnapshot",
  "description": "Current debts (credit cards, mortgage, other loans). Current-state data, parallel to HoldingsSnapshot — not versioned/append-only like the IPS. Captured during Goals & Onboarding, since it isn't reliably derivable from checking transaction data alone (a transaction feed shows payments, not balances or interest rates).",
  "type": "object",
  "required": ["user_id", "as_of", "liabilities"],
  "properties": {
    "user_id": { "type": "string" },
    "as_of": { "type": "string", "format": "date-time" },
    "liabilities": {
      "type": "array",
      "items": {
        "type": "object",
        "required": ["liability_id", "type", "balance_usd", "minimum_payment_usd"],
        "properties": {
          "liability_id": { "type": "string" },
          "type": {
            "type": "string",
            "enum": [
              "credit_card",
              "mortgage",
              "auto_loan",
              "student_loan",
              "heloc",
              "other"
            ]
          },
          "description": {
            "type": "string",
            "description": "e.g. \"Premium Rewards Card\", \"Primary residence mortgage\"."
          },
          "balance_usd": { "type": "number", "minimum": 0 },
          "interest_rate_percent": {
            "type": "number",
            "minimum": 0,
            "description": "APR. Notably absent from checking transaction data — must be self-reported."
          },
          "minimum_payment_usd": { "type": "number", "minimum": 0 }
        }
      }
    },
    "total_liabilities_usd": {
      "type": "number",
      "minimum": 0,
      "description": "Sum of all balance_usd. Used alongside HoldingsSnapshot.total_value_usd for a net-worth view, and as an input to risk-capacity judgment during onboarding."
    }
  }
}
